{
  "$schema": "model-routing-policy.schema.json",
  "schemaVersion": 1,
  "policyVersion": "2026-10-21",
  "evidenceAsOfDate": "2026-10-21",
  "authority": {
    "repositoryPath": "docs/system/domains/model-routing-policy.md",
    "upstreamRepository": "agent-orc/agent-studio",
    "upstreamPath": "docs/system/domains/model-routing-policy.md",
    "contentSha256": "241781f1c62ee971643036a1287067d9d11e541787430debf03ff3cd5b3d1363",
    "synchronization": "Token Economy 2026-10-21 revision adds selectable Sonnet 5.5 and documented CLI version gates for Sonnet 5.5 and Haiku 5.5. Defaults, score bands, correctness floors, priors and fallbacks remain unchanged. The policy text also documents the Antigravity provider and test-only Gemini pins. TE-62 and TE-63 catalogue changes are included. No upstream update is claimed. TE-72 adds catalog-only GPT-6.1 Terra (unsupported) and Gemini 4 Carbon (restricted); neither is selectable or used for a route, fallback, tier, or correctness floor."
  },
  "providers": [
    {
      "id": "openai",
      "cliId": "codex",
      "cliLabel": "Codex CLI",
      "evidenceStatus": "observed"
    },
    {
      "id": "anthropic",
      "cliId": "claude-code",
      "cliLabel": "Claude Code CLI",
      "evidenceStatus": "observed"
    },
    {
      "id": "google",
      "cliId": "antigravity",
      "cliLabel": "Antigravity CLI (agy)",
      "evidenceStatus": "observed"
    }
  ],
  "thinkingLevels": [
    {
      "id": "minimal",
      "rank": 0,
      "evidenceStatus": "observed"
    },
    {
      "id": "low",
      "rank": 1,
      "evidenceStatus": "observed"
    },
    {
      "id": "medium",
      "rank": 2,
      "evidenceStatus": "observed"
    },
    {
      "id": "high",
      "rank": 3,
      "evidenceStatus": "observed"
    },
    {
      "id": "xhigh",
      "rank": 4,
      "evidenceStatus": "observed"
    },
    {
      "id": "ultra",
      "rank": 5,
      "evidenceStatus": "observed"
    },
    {
      "id": "max",
      "rank": 6,
      "evidenceStatus": "observed"
    }
  ],
  "models": [
    {
      "canonicalId": "claude-haiku-5-5",
      "aliases": [],
      "minimumCliVersion": "2.1.293",
      "providerId": "anthropic",
      "cliId": "claude-code",
      "priceCatalogId": "claude-haiku-5-5",
      "mediaCatalogModelId": "*",
      "trustModelId": "claude-haiku-5-5",
      "supportedThinkingLevels": [
        "low",
        "medium",
        "high",
        "xhigh",
        "max"
      ],
      "routingStatus": "selectable",
      "evidenceStatus": "provisional",
      "provisional": true,
      "capabilityTier": "light",
      "workflowRoles": [
        "boundedPipelineDecision"
      ],
      "note": "Claude Code documents low/medium/high/xhigh/max with default medium and minimum v2.1.293: https://code.claude.com/docs/en/model-config (retrieved 2026-10-21). Operator reports Claude Code 2.1.305 installed on TUFI2, agent-runner-01 and KORI review containers, with the KORI Dockerfile pinned; agent-runner-01 runner-credential claude -p --model claude-haiku-5-5 answered on 2026-10-20. Earlier v2.1.301 modelUsage confirmed the canonical model; v2.1.281 fell back to Haiku 4.5. Explicit bounded classification, auto-tagging and fixture pin only; Sonnet low remains the coding economy floor. No default route, fallback or automatic migration.",
      "testOnly": false
    },
    {
      "canonicalId": "gemini-4-argon",
      "aliases": [
        "gemini-4-argon-low",
        "gemini-4-argon-medium",
        "gemini-4-argon-high"
      ],
      "providerId": "google",
      "cliId": "antigravity",
      "priceCatalogId": "gemini-4-argon",
      "mediaCatalogModelId": "*",
      "trustModelId": "gemini-4-argon",
      "supportedThinkingLevels": [
        "low",
        "medium",
        "high"
      ],
      "routingStatus": "selectable",
      "evidenceStatus": "provisional",
      "provisional": true,
      "capabilityTier": "frontier",
      "workflowRoles": [
        "coreTask"
      ],
      "note": "Test-only: explicit operator pin only; no default tier, automatic migration, or fallback. agy 1.4.0 models output on 2026-10-16 listed low/medium/high suffixed ids; agy also accepts --effort low|medium|high|xhigh|max, but the model docs confirm only low/medium/high for this model. Access path for orchestrated runs is unresolved. Vendor FAQ: direct agy -p scripting/CI is intended; wrapping agy in third-party coding agents is not supported under consumer plans; API-key path is documented separately: https://www.antigravity.google/docs/faq/. API prices do not establish CLI subscription costs.",
      "testOnly": true
    },
    {
      "canonicalId": "gemini-3.8-flash",
      "aliases": [
        "gemini-3.8-flash-low",
        "gemini-3.8-flash-medium",
        "gemini-3.8-flash-high"
      ],
      "providerId": "google",
      "cliId": "antigravity",
      "priceCatalogId": "gemini-3.8-flash",
      "mediaCatalogModelId": "*",
      "trustModelId": "gemini-3.8-flash",
      "supportedThinkingLevels": [
        "low",
        "medium",
        "high"
      ],
      "routingStatus": "selectable",
      "evidenceStatus": "provisional",
      "provisional": true,
      "capabilityTier": "balanced",
      "workflowRoles": [
        "coreTask"
      ],
      "note": "Test-only: explicit operator pin only; no default tier, automatic migration, or fallback. agy 1.4.0 models output on 2026-10-16 listed low/medium/high suffixed ids; agy also accepts --effort low|medium|high|xhigh|max, but the model docs confirm only low/medium/high for this model. Access path for orchestrated runs is unresolved. Vendor FAQ: direct agy -p scripting/CI is intended; wrapping agy in third-party coding agents is not supported under consumer plans; API-key path is documented separately: https://www.antigravity.google/docs/faq/. API prices do not establish CLI subscription costs.",
      "testOnly": true
    },
    {
      "canonicalId": "gpt-5.6-luna",
      "aliases": [
        "luna"
      ],
      "providerId": "openai",
      "cliId": "codex",
      "priceCatalogId": "gpt-5.6-luna",
      "mediaCatalogModelId": "*",
      "trustModelId": "gpt-5.6-luna",
      "supportedThinkingLevels": [
        "low",
        "medium",
        "high",
        "xhigh",
        "max"
      ],
      "routingStatus": "selectable",
      "evidenceStatus": "provisional",
      "provisional": true,
      "capabilityTier": "light",
      "workflowRoles": [
        "coreTask"
      ],
      "note": "No Luna cohort existed in the 2026-07-23 benchmark; this is an unvalidated cost-saving hypothesis. Ladder refreshed 2026-09-29 (TE-59) from the Codex CLI model catalogue served to codex-cli 0.155.0 on 2026-09-29 (and bundled in rust-v0.157.0 through rust-v0.159.0): max added; minimal and ultra removed because the CLI does not advertise them for this model (a CLI that accepts an ultra flag without advertising it is not treated as support)."
    },
    {
      "canonicalId": "gpt-5.6-terra",
      "aliases": [
        "terra"
      ],
      "providerId": "openai",
      "cliId": "codex",
      "priceCatalogId": "gpt-5.6-terra",
      "mediaCatalogModelId": "*",
      "trustModelId": "gpt-5.6-terra",
      "supportedThinkingLevels": [
        "low",
        "medium",
        "high",
        "xhigh",
        "max",
        "ultra"
      ],
      "routingStatus": "selectable",
      "evidenceStatus": "provisional",
      "provisional": true,
      "capabilityTier": "balanced",
      "workflowRoles": [
        "coreTask"
      ],
      "note": "Eight historical Terra/medium records had no known grades and no trustworthy terminal cohort. Ladder refreshed 2026-09-29 (TE-59) from the Codex CLI model catalogue served to codex-cli 0.155.0 on 2026-09-29 (and bundled in rust-v0.157.0 through rust-v0.159.0): max added and minimal removed."
    },
    {
      "canonicalId": "gpt-5.6-sol",
      "aliases": [
        "gpt-5.6",
        "sol"
      ],
      "providerId": "openai",
      "cliId": "codex",
      "priceCatalogId": "gpt-5.6-sol",
      "mediaCatalogModelId": "*",
      "trustModelId": "gpt-5.6-sol",
      "supportedThinkingLevels": [
        "low",
        "medium",
        "high",
        "xhigh",
        "max",
        "ultra"
      ],
      "routingStatus": "selectable",
      "evidenceStatus": "observational",
      "provisional": false,
      "capabilityTier": "frontier",
      "workflowRoles": [
        "coreTask",
        "boundedPipelineDecision"
      ],
      "note": "Sol/medium has the strongest favorable historical signal; Sol/xhigh remains a correctness floor, not a blanket default. Ladder refreshed 2026-09-29 (TE-59) from the Codex CLI model catalogue served to codex-cli 0.155.0 on 2026-09-29 (and bundled in rust-v0.157.0 through rust-v0.159.0): max added; minimal removed after the API rejected it in a runner probe."
    },
    {
      "canonicalId": "gpt-6-astra",
      "aliases": [
        "astra"
      ],
      "providerId": "openai",
      "cliId": "codex",
      "priceCatalogId": "gpt-6-astra",
      "mediaCatalogModelId": "*",
      "trustModelId": "gpt-6-astra",
      "supportedThinkingLevels": [
        "low",
        "medium",
        "high",
        "xhigh",
        "max",
        "ultra"
      ],
      "routingStatus": "selectable",
      "evidenceStatus": "provisional",
      "provisional": true,
      "capabilityTier": "frontier",
      "workflowRoles": [
        "coreTask"
      ],
      "note": "Selectable for explicit evaluation and operator pins, provisional. Operator observed two access_programs.cyber HTTP 400s in about eight runs on 2026-09-18. No comparable local completion cohort; not a default tier or equivalent provider fallback."
    },
    {
      "canonicalId": "gpt-6-sol",
      "aliases": [],
      "providerId": "openai",
      "cliId": "codex",
      "priceCatalogId": "gpt-6-sol",
      "mediaCatalogModelId": "*",
      "trustModelId": "gpt-6-sol",
      "supportedThinkingLevels": [